{
  "model": "claude-opus-5-5",
  "max_tokens": 1024,
  "tools": [
    {
      "name": "get_weather",
      "description": "Get the current weather for a given location.",
      "input_schema": {
        "type": "object",
        "properties": {
          "location": {
            "type": "string",
            "description": "City and state, e.g. San Francisco, CA"
          }
        },
        "required": ["location"]
      }
    }
  ],
  "tool_choice": { "type": "auto", "disable_parallel_tool_use": true },
  "messages": [
    { "role": "user", "content": "What's the weather in San Francisco?" }
  ]
}
